{"schema":"https://debz.dev/schema/native-transaction-provenance-v2","version":2,"authority":{"execution_request_schema":"https://debz.dev/schema/native-execution-request-v4","execution_request_version":4,"authorization_schema":"https://debz.dev/schema/native-transaction-authorization-v2","authorization_version":2,"program_schema":"https://debz.dev/schema/native-transaction-program-v2","program_version":2,"exact_lock_schema":"https://debz.dev/schema/exact-closure-lock-v3","exact_lock_version":3,"execution_intent_schema":"https://debz.dev/schema/native-execution-intent-v2","execution_intent_version":2,"progress_schema":"https://debz.dev/schema/native-execution-progress-v3","progress_version":3},"attempt_id":"1111111111111111111111111111111111111111111111111111111111111111","backend":"native","install_root":"/srv/root","root_identity_sha256":"1b292ed83668a7231965384ce66f907a5ebd141db7f6f127fe3cad8ef6589b90","root_inode":42,"operation":{"package_transaction":"install"},"request_sha256":"3333333333333333333333333333333333333333333333333333333333333333","policy_sha256":"4444444444444444444444444444444444444444444444444444444444444444","authorization_sha256":"5555555555555555555555555555555555555555555555555555555555555555","program_sha256":"6666666666666666666666666666666666666666666666666666666666666666","exact_lock_sha256":"7777777777777777777777777777777777777777777777777777777777777777","artifact_evidence_sha256":"8888888888888888888888888888888888888888888888888888888888888888","initial_database_generation_sha256":"9999999999999999999999999999999999999999999999999999999999999999","execution_intent_sha256":"aaaaaaaaaaaaaaaaaaaaaaaaaaaaaaaaaaaaaaaaaaaaaaaaaaaaaaaaaaaaaaaa","progress_head_sha256":"bbbbbbbbbbbbbbbbbbbbbbbbbbbbbbbbbbbbbbbbbbbbbbbbbbbbbbbbbbbbbbbb","progress_record_count":12,"script_outcomes_sha256":"cccccccccccccccccccccccccccccccccccccccccccccccccccccccccccccccc","trigger_evidence_sha256":"dddddddddddddddddddddddddddddddddddddddddddddddddddddddddddddddd","final_database_generation_sha256":"eeeeeeeeeeeeeeeeeeeeeeeeeeeeeeeeeeeeeeeeeeeeeeeeeeeeeeeeeeeeeeee","final_state_sha256":"ffffffffffffffffffffffffffffffffffffffffffffffffffffffffffffffff","recovered_phase_count":1,"evidence_root":"var/lib/debz/native-receipts-v1/1111111111111111111111111111111111111111111111111111111111111111","evidence_files":[{"kind":"authorization","path":"var/lib/debz/native-receipts-v1/1111111111111111111111111111111111111111111111111111111111111111/authorization.json","sha256":"1111111111111111111111111111111111111111111111111111111111111111","document_sha256":"2222222222222222222222222222222222222222222222222222222222222222","action":null,"size":1},{"kind":"program","path":"var/lib/debz/native-receipts-v1/1111111111111111111111111111111111111111111111111111111111111111/program.json","sha256":"2222222222222222222222222222222222222222222222222222222222222222","document_sha256":"3333333333333333333333333333333333333333333333333333333333333333","action":null,"size":1},{"kind":"intent","path":"var/lib/debz/native-receipts-v1/1111111111111111111111111111111111111111111111111111111111111111/intent.json","sha256":"3333333333333333333333333333333333333333333333333333333333333333","document_sha256":"4444444444444444444444444444444444444444444444444444444444444444","action":null,"size":1},{"kind":"progress","path":"var/lib/debz/native-receipts-v1/1111111111111111111111111111111111111111111111111111111111111111/progress.json","sha256":"4444444444444444444444444444444444444444444444444444444444444444","document_sha256":"5555555555555555555555555555555555555555555555555555555555555555","action":null,"size":1},{"kind":"managed_state","path":"var/lib/debz/native-receipts-v1/1111111111111111111111111111111111111111111111111111111111111111/managed-state.json","sha256":"5555555555555555555555555555555555555555555555555555555555555555","document_sha256":"6666666666666666666666666666666666666666666666666666666666666666","action":null,"size":1},{"kind":"trigger_events","path":"var/lib/debz/native-receipts-v1/1111111111111111111111111111111111111111111111111111111111111111/trigger-events.json","sha256":"6666666666666666666666666666666666666666666666666666666666666666","document_sha256":"7777777777777777777777777777777777777777777777777777777777777777","action":null,"size":1}],"evidence_files_sha256":"6b21fd01e88fcfd40fa61d438da2c15087c3ba11f83741fba511ad55cb3d5c2d","final_state_kind":"package_database_closure_v1","outcome":"succeeded","detail":"recovered","digest_sha256":"845de6c23d06ac3817ecde2a0e8be842ce7cf9223abfc36023160353dff63297"}
